{
  "id": "GUARD-GOV-027",
  "title": "New Zealand Superannuation and Retirement Income Act 2001",
  "category": "governance",
  "subcategory": "regulatory-compliance",
  "type": "policy",
  "status": "approved",
  "version": "2.0",
  "description": "New Zealand legislation establishing the legal framework for superannuation entitlements, the New Zealand Superannuation Fund, the Guardians of New Zealand Superannuation, and the Retirement Commissioner. Administered by the Ministry of Social Development and The Treasury, it defines age and residential qualifications, payment structures, fund management, and oversight mechanisms for retirement income.",
  "tags": [
    "superannuation",
    "retirement-income",
    "fund-management",
    "regulatory-framework",
    "new-zealand",
    "governance",
    "nz-legislation",
    "public-act",
    "fund-governance"
  ],
  "source": {
    "type": "external_url",
    "url": "https://www.legislation.govt.nz/act/public/2001/84/en/latest/",
    "page_title": "New Zealand Superannuation and Retirement Income Act 2001 | New Zealand Legislation",
    "content_hash": "bcf3c9d247b7b517aabcefca56cf83a80666fde1c0cce31f0fe224cf24a06a9d",
    "last_fetched": "2026-04-21T21:40:17Z"
  },
  "related_guardrails": [
    "GUARD-GOV-022",
    "GUARD-GOV-023",
    "GUARD-GOV-021"
  ],
  "approved_by": null,
  "approved_date": null,
  "review_due": null,
  "change_log": [
    {
      "version": "2.0",
      "date": "2026-04-21",
      "author": "auto-generated",
      "summary": "Updated source URL, content hash, and last_fetched timestamp from external_url source. Enhanced tags to include nz-legislation, public-act, and fund-governance for better discoverability and alignment with governance framework taxonomy."
    }
  ],
  "owner": "Ministry of Social Development; The Treasury"
}
