{
  "id": "GUARD-GOV-031",
  "title": "Employment Relations Act 2000 (New Zealand)",
  "category": "governance",
  "subcategory": "employment-law",
  "type": "policy",
  "status": "approved",
  "version": "2.0",
  "description": "New Zealand legislation governing employment relationships, including provisions on good faith dealings, union recognition, collective bargaining, individual employment agreements, and employee protections. Administered by the Ministry of Business, Innovation, and Employment.",
  "tags": [
    "employment-law",
    "new-zealand",
    "governance",
    "labor-relations",
    "collective-bargaining",
    "employee-rights",
    "compliance"
  ],
  "source": {
    "type": "external_url",
    "url": "https://www.legislation.govt.nz/act/public/2000/24/en/latest/",
    "page_title": "Employment Relations Act 2000 | New Zealand Legislation",
    "content_hash": "4e73b1ba34ab03e9831007473ce7173afb95a56ce5e877a25a584fe8fd7dac35",
    "last_fetched": "2026-04-21T21:40:24Z"
  },
  "related_guardrails": [
    "GUARD-GOV-029",
    "GUARD-GOV-030",
    "GUARD-GOV-028"
  ],
  "approved_by": null,
  "approved_date": null,
  "review_due": null,
  "change_log": [
    {
      "version": "1.0",
      "date": "2024-01-01",
      "author": "auto-generated",
      "summary": "Initial creation"
    },
    {
      "version": "2.0",
      "date": "2026-04-21",
      "author": "auto-generated",
      "summary": "Updated source to external_url with latest legislation.govt.nz endpoint and current content hash. Enhanced description and tag alignment with employment law governance framework."
    }
  ],
  "owner": "Legal and Compliance"
}
