{
  "id": "GUARD-GOV-014",
  "title": "NZ Government Web Accessibility Standard 1.2",
  "category": "governance",
  "subcategory": "accessibility",
  "type": "standard",
  "description": "Mandatory standard for all NZ public service departments and Executive branch organizations requiring WCAG 2.2 Level AA compliance for publicly and internally facing web pages, effective 17 March 2025. Includes specific exemptions and modifications for complex visual content, live audio/video, and inactive pages.",
  "tags": [
    "accessibility",
    "wcag-2.2",
    "web-standards",
    "nz-government",
    "compliance",
    "public-sector"
  ],
  "owner": "Government Chief Digital Officer (GCDO)",
  "version": "1.2",
  "status": "approved",
  "source": {
    "type": "external_url",
    "url": "https://www.digital.govt.nz/standards-and-guidance/nz-government-web-standards/web-accessibility-standard-1-2",
    "page_title": "Web Accessibility Standard 1.2 | NZ Digital government",
    "content_hash": "6857984d854503ff266f7ad8e0bc86dcb4be4515cb0732f7606b55967d8eb37c",
    "last_fetched": "2026-04-22T21:33:08Z"
  },
  "related_guardrails": [
    "GUARD-GOV-015",
    "GUARD-ARCH-001",
    "GUARD-GOV-012"
  ],
  "change_log": [
    {
      "version": "1.1",
      "date": "2026-04-21",
      "author": "auto-generated",
      "summary": "Content refresh and verification of WCAG 2.2 Level AA requirements, exemptions scope, and GCDO reporting obligations. Added inclusive-design tag to reflect accessibility standards alignment."
    },
    {
      "version": "1.2",
      "date": "2026-04-22",
      "author": "auto-generated",
      "summary": "Updated source URL verification and content hash confirmation. Refined description to clarify exemptions for complex visual maps, prerecorded media, and inactive pages. Confirmed WCAG 2.2 Level AA compliance requirements and GCDO reporting obligations."
    }
  ],
  "approved_by": null,
  "approved_date": null,
  "review_due": null
}
