{
  "id": "GUARD-API-002",
  "title": "API Security Guidelines — Part B (NZ Digital Government 2022)",
  "category": "api",
  "subcategory": "security",
  "type": "guideline",
  "description": "Comprehensive reference architecture and technical implementation guidance for securing RESTful and modern APIs (GraphQL, AsyncAPI, gRPC). Covers authentication, authorization, identity management, threat protection, and Zero Trust principles for government API deployments.",
  "tags": [
    "api-security",
    "authentication",
    "authorization",
    "oauth",
    "zero-trust",
    "identity-management",
    "rest-api",
    "threat-protection"
  ],
  "status": "approved",
  "version": "1.0",
  "owner": "API Security & Architecture Team",
  "source": {
    "type": "external_url",
    "url": "https://www.digital.govt.nz/dmsdocument/231~api-guidelines-part-b-api-security-2022/html",
    "page_title": "API guidelines — Part B: API security 2022 | NZ Digital government",
    "content_hash": "ce2699dc9c000de085404fc2b59f5f8382abf3fc729397402850353c42335dcd",
    "last_fetched": "2026-04-02T07:46:53Z"
  },
  "related_guardrails": [
    "GUARD-API-001",
    "GUARD-SEC-001",
    "GUARD-GOV-005"
  ],
  "approved_by": null,
  "approved_date": null,
  "review_due": null,
  "change_log": [
    {
      "version": "1.0",
      "date": "2026-04-02",
      "author": "auto-generated",
      "summary": "Initial ingestion of NZ Digital Government API Security Guidelines Part B covering authentication, authorization, identity management, and Zero Trust principles for API deployments."
    }
  ]
}
