{
  "id": "GUARD-CLOUD-001",
  "title": "NZ Government Cloud First Policy",
  "category": "cloud",
  "subcategory": "cloud-adoption",
  "type": "policy",
  "version": "2.0",
  "status": "approved",
  "description": "New Zealand government's mandatory cloud-first policy requiring public sector organisations to adopt public cloud services for information systems unless specific exceptions apply. Covers data classification requirements, multi-cloud strategies, cost optimization, risk assessment, and sustainability considerations.",
  "tags": [
    "cloud-first",
    "public-cloud",
    "government-policy",
    "data-classification",
    "multi-cloud",
    "nz-government"
  ],
  "owner": "Government Chief Digital Officer (GCDO)",
  "source": {
    "type": "external_url",
    "url": "https://www.digital.govt.nz/standards-and-guidance/technology-and-architecture/cloud-services/cloud-adoption-policy-and-strategy/cabinet-requirement",
    "page_title": "Cloud First policy | NZ Digital government",
    "content_hash": "3b90fca8141637e575b4ca4777163237fa6728cfb14f829c268a4e76fb23e9ef",
    "last_fetched": "2026-04-21T21:39:24Z"
  },
  "related_guardrails": [
    "GUARD-CLOUD-002",
    "GUARD-GOV-017",
    "GUARD-SEC-007"
  ],
  "approved_by": null,
  "approved_date": null,
  "review_due": null,
  "change_log": [
    {
      "version": "1.0",
      "date": "2024-01-15",
      "author": "auto-generated",
      "summary": "Initial import of NZ Government Cloud First Policy from digital.govt.nz"
    },
    {
      "version": "2.0",
      "date": "2026-04-21",
      "author": "auto-generated",
      "summary": "Updated content from external source; verified current policy requirements and sustainability considerations; content hash updated to reflect latest policy version"
    }
  ]
}
