{
  "id": "GUARD-GOV-036",
  "title": "Copyright Act 1994 — New Zealand Legislation",
  "category": "governance",
  "subcategory": "intellectual-property",
  "type": "policy",
  "status": "approved",
  "version": "2.0",
  "description": "New Zealand legislation consolidating and amending copyright law, covering ownership, duration, infringement, permitted acts, moral rights, and enforcement mechanisms. Relevant for organizations handling creative works, digital content, and intellectual property.",
  "tags": [
    "copyright",
    "intellectual-property",
    "new-zealand",
    "legislation",
    "digital-content",
    "licensing",
    "infringement",
    "legal-compliance",
    "content-protection",
    "enforcement"
  ],
  "source": {
    "type": "external_url",
    "url": "https://www.legislation.govt.nz/act/public/1994/143/en/latest/",
    "page_title": "Copyright Act 1994 | New Zealand Legislation",
    "content_hash": "96633d2364846eadb93c17c988fa70f148373f7486f5db238f8b42f84878e7b6",
    "last_fetched": "2026-04-21T21:40:30Z"
  },
  "related_guardrails": [
    "GUARD-GOV-010",
    "GUARD-GOV-013",
    "GUARD-GOV-026"
  ],
  "approved_by": null,
  "approved_date": null,
  "review_due": null,
  "change_log": [
    {
      "version": "2.0",
      "date": "2026-04-21",
      "author": "auto-generated",
      "summary": "Updated from draft. Enhanced description and tag list to reflect full scope of copyright legislation including infringement, enforcement, and licensing mechanisms. Added related guardrails for intellectual property governance alignment."
    }
  ],
  "owner": "Legal / Compliance"
}
