{
  "id": "GUARD-GOV-034",
  "title": "Copyright Act 1994 \u2014 New Zealand Legislation",
  "category": "governance",
  "subcategory": "legal-compliance",
  "type": "policy",
  "description": "New Zealand statutory legislation governing copyright ownership, infringement, moral rights, and remedies. Establishes the legal framework for protecting original literary, dramatic, musical, artistic works, sound recordings, films, and communication works, with provisions for exceptions, enforcement, and dispute resolution.",
  "tags": [
    "copyright",
    "intellectual-property",
    "legal-compliance",
    "new-zealand",
    "content-protection",
    "licensing",
    "enforcement"
  ],
  "status": "draft",
  "version": "1.0",
  "owner": "Legal / Compliance Team",
  "source": {
    "type": "external_url",
    "url": "https://www.legislation.govt.nz/act/public/1994/143/en/latest/",
    "page_title": "Copyright Act 1994 | New Zealand Legislation",
    "content_hash": "310e55e8d8c209a2dcd572724b3f624d8757e110d2f78c8f830798e19ff6e52f",
    "last_fetched": "2026-04-02T07:47:59Z"
  },
  "related_guardrails": [
    "GUARD-GOV-010",
    "GUARD-GOV-013",
    "GUARD-GOV-026"
  ],
  "change_log": [
    {
      "version": "1.0",
      "date": "2026-04-02",
      "author": "auto-generated",
      "summary": "Initial guardrail created from New Zealand Copyright Act 1994 legislation"
    }
  ],
  "approved_by": null,
  "approved_date": null,
  "review_due": null
}